{
  "$schema": "https://json-schema.org/draft/2020-12/schema",
  "$id": "https://captivity-reloaded.invalid/mod-api/v1/enemy-animation.schema.json",
  "title": "Captivity Reloaded Normalized Enemy Animation",
  "x-stability": "stable",
  "type": "object",
  "additionalProperties": false,
  "required": ["schemaVersion", "type", "id", "enemy", "displayName", "durationSeconds", "frameRate", "loop", "tracks"],
  "properties": {
    "schemaVersion": { "const": 1, "x-stability": "stable" },
    "type": { "const": "enemyAnimation", "x-stability": "stable" },
    "id": { "type": "string", "pattern": "^[a-z0-9][a-z0-9._-]*:enemy-animation/[a-z0-9][a-z0-9._/-]*$", "x-stability": "stable" },
    "enemy": { "type": "string", "pattern": "^[a-z0-9][a-z0-9._-]*:enemy/[a-z0-9][a-z0-9._/-]*$", "x-stability": "stable" },
    "displayName": { "type": "string", "minLength": 1, "maxLength": 100, "x-stability": "stable" },
    "durationSeconds": { "type": "number", "exclusiveMinimum": 0, "maximum": 60, "x-stability": "stable" },
    "frameRate": { "type": "number", "exclusiveMinimum": 0, "maximum": 240, "x-stability": "stable" },
    "loop": { "type": "boolean", "x-stability": "stable" },
    "tracks": { "type": "array", "minItems": 1, "maxItems": 1024, "items": { "$ref": "#/$defs/numericTrack" }, "x-stability": "stable" },
    "objectTracks": { "type": "array", "maxItems": 256, "items": { "$ref": "#/$defs/objectTrack" }, "x-stability": "stable" },
    "events": { "type": "array", "maxItems": 64, "items": { "$ref": "#/$defs/event" }, "x-stability": "stable" },
    "effects": { "type": "array", "maxItems": 128, "items": { "$ref": "#/$defs/effect" }, "x-stability": "stable" },
    "effectTriggers": { "type": "array", "maxItems": 512, "items": { "$ref": "#/$defs/effectTrigger" }, "x-stability": "stable" },
    "warnings": { "type": "array", "items": { "type": "string" }, "x-stability": "experimental" },
    "source": { "type": "object", "additionalProperties": true, "x-stability": "experimental" }
  },
  "$defs": {
    "target": { "type": "string", "pattern": "^(?:bone|sprite)/[a-z0-9][a-z0-9-]*(?:/[a-z0-9][a-z0-9-]*)*$" },
    "key": {
      "type": "object", "additionalProperties": false, "required": ["time", "value", "inTangent", "outTangent"],
      "properties": { "time": { "type": "number", "minimum": 0 }, "value": { "type": "number" }, "inTangent": { "type": ["number", "null"] }, "outTangent": { "type": ["number", "null"] } }
    },
    "numericTrack": {
      "type": "object", "additionalProperties": false, "required": ["target", "property", "keys"],
      "properties": {
        "target": { "$ref": "#/$defs/target" },
        "property": { "enum": ["position.x", "position.y", "rotation.z", "scale.x", "scale.y", "color.r", "color.g", "color.b", "color.a", "sortingOrder"] },
        "keys": { "type": "array", "minItems": 1, "items": { "$ref": "#/$defs/key" } }
      }
    },
    "objectTrack": {
      "type": "object", "additionalProperties": false, "required": ["target", "property", "keys"],
      "properties": {
        "target": { "type": "string", "pattern": "^sprite/[a-z0-9][a-z0-9-]*(?:/[a-z0-9][a-z0-9-]*)*$" },
        "property": { "const": "sprite" },
        "keys": { "type": "array", "minItems": 1, "items": { "type": "object", "additionalProperties": false, "required": ["time", "name"], "properties": {
          "time": { "type": "number", "minimum": 0 }, "asset": { "type": ["string", "null"] }, "name": { "type": "string", "minLength": 1 }
        } } }
      }
    },
    "event": {
      "type": "object", "additionalProperties": false, "required": ["time", "type"],
      "properties": {
        "time": { "type": "number", "minimum": 0 }, "type": { "enum": ["attackHit", "impulse", "sound", "cameraShake", "spriteEffect", "cue"] },
        "amount": { "type": ["number", "null"] }, "x": { "type": ["number", "null"] }, "y": { "type": ["number", "null"] }, "relativeToFacing": { "type": ["boolean", "null"] },
        "file": { "type": ["string", "null"] }, "volume": { "type": ["number", "null"] }, "region": { "type": ["string", "null"] }, "bone": { "type": ["string", "null"] },
        "durationSeconds": { "type": ["number", "null"] }, "scale": { "type": ["number", "null"] }, "sortingOrder": { "type": ["integer", "null"] },
        "cue": { "type": ["string", "null"], "pattern": "^[a-z0-9][a-z0-9._/-]*$", "maxLength": 80 }, "index": { "type": ["integer", "null"], "minimum": 0, "maximum": 255 }
      }
    },
    "effect": {
      "type": "object",
      "required": ["id", "trigger", "index", "target", "durationSeconds", "loop", "maxParticles", "startLifetimeMin", "startLifetimeMax", "startSpeedMin", "startSpeedMax", "startSizeMin", "startSizeMax", "gravityMin", "gravityMax", "scaleX", "scaleY", "scaleZ", "simulationSpace", "startColorMin", "startColorMax", "emissionRateMin", "emissionRateMax", "shapeEnabled", "shape", "shapeRadius", "shapeAngle", "textureSheetTilesX", "textureSheetTilesY", "textureSheetSprites", "sortingOrder", "source"],
      "properties": {
        "id": { "type": "string", "pattern": "^[a-z0-9][a-z0-9._/-]*$" }, "kind": { "enum": ["particle", "light", "trail", "decal"] }, "trigger": { "type": "string" }, "index": { "type": "integer", "minimum": 0 },
        "target": { "type": "string" }, "durationSeconds": { "type": "number", "minimum": 0, "maximum": 600 }, "loop": { "type": "boolean" },
        "maxParticles": { "type": "integer", "minimum": 0, "maximum": 100000 },
        "startLifetimeMin": { "type": "number" }, "startLifetimeMax": { "type": "number" }, "startSpeedMin": { "type": "number" }, "startSpeedMax": { "type": "number" },
        "startSizeMin": { "type": "number" }, "startSizeMax": { "type": "number" }, "gravityMin": { "type": "number" }, "gravityMax": { "type": "number" },
        "scaleX": { "type": "number" }, "scaleY": { "type": "number" }, "scaleZ": { "type": "number" },
        "positionX": { "type": "number" }, "positionY": { "type": "number" }, "positionZ": { "type": "number" },
        "rotationX": { "type": "number" }, "rotationY": { "type": "number" }, "rotationZ": { "type": "number" }, "simulationSpace": { "enum": ["Local", "World", "Custom"] },
        "startColorMin": { "$ref": "#/$defs/color" }, "startColorMax": { "$ref": "#/$defs/color" },
        "emissionRateMin": { "type": "number", "minimum": 0 }, "emissionRateMax": { "type": "number", "minimum": 0 },
        "shapeEnabled": { "type": "boolean" }, "shape": { "type": "string" }, "shapeRadius": { "type": "number", "minimum": 0 }, "shapeAngle": { "type": "number" },
        "textureSheetTilesX": { "type": "integer", "minimum": 1, "maximum": 64 }, "textureSheetTilesY": { "type": "integer", "minimum": 1, "maximum": 64 }, "textureSheetFrame": { "type": "integer", "minimum": 0, "maximum": 4095 }, "textureSheetSprites": { "type": "array", "items": { "type": "string" } },
        "bursts": { "type": "array", "maxItems": 64, "items": { "$ref": "#/$defs/particleBurst" } },
        "startLifetimeCurve": { "$ref": "#/$defs/particleCurve" }, "startSpeedCurve": { "$ref": "#/$defs/particleCurve" }, "startSizeCurve": { "$ref": "#/$defs/particleCurve" },
        "gravityCurve": { "$ref": "#/$defs/particleCurve" }, "emissionRateCurve": { "$ref": "#/$defs/particleCurve" }, "emissionRateOverDistanceCurve": { "$ref": "#/$defs/particleCurve" },
        "startColorGradient": { "$ref": "#/$defs/particleGradient" },
        "colorOverLifetime": { "$ref": "#/$defs/particleGradient" }, "sizeOverLifetime": { "$ref": "#/$defs/particleAxes" },
        "velocityOverLifetime": { "$ref": "#/$defs/particleAxes" }, "rotationOverLifetime": { "$ref": "#/$defs/particleAxes" }, "noise": { "$ref": "#/$defs/particleNoise" },
        "textureSheetFrameOverTime": { "$ref": "#/$defs/particleCurve" }, "textureSheetStartFrame": { "$ref": "#/$defs/particleCurve" },
        "textureSheetAnimation": { "enum": ["WholeSheet", "SingleRow"] }, "textureSheetCycleCount": { "type": "integer", "minimum": 1, "maximum": 1000 },
        "textureSheetRowIndex": { "type": "integer", "minimum": 0, "maximum": 63 }, "textureSheetUseRandomRow": { "type": "boolean" },
        "sortingLayer": { "type": "string" }, "sortingOrder": { "type": "integer" }, "renderMode": { "type": "string" }, "mesh": { "type": "string" },
        "material": { "type": "string" }, "texture": { "type": "string", "pattern": "^(?![A-Za-z]:|/|.*(?:^|/)\\.\\.(?:/|$)).+\\.png$" },
        "lightIntensity": { "type": "number", "minimum": 0, "maximum": 20 }, "lightRadius": { "type": "number", "exclusiveMinimum": 0, "maximum": 100 },
        "trailWidth": { "type": "number", "exclusiveMinimum": 0, "maximum": 20 }, "trailTime": { "type": "number", "exclusiveMinimum": 0, "maximum": 30 },
        "decalPixelsPerUnit": { "type": "number", "minimum": 1, "maximum": 1024 }, "source": { "type": "object" }
      },
      "additionalProperties": false
    },
    "effectTrigger": {
      "type": "object", "additionalProperties": false, "required": ["time", "source", "effects"],
      "properties": { "time": { "type": "number", "minimum": 0 }, "source": { "type": "string" }, "effects": { "type": "array", "minItems": 1, "uniqueItems": true, "items": { "type": "string" } } }
    },
    "color": {
      "type": "object", "additionalProperties": false, "required": ["r", "g", "b", "a"],
      "properties": { "r": { "type": "number" }, "g": { "type": "number" }, "b": { "type": "number" }, "a": { "type": "number" } }
    },
    "particleCurveKey": { "type": "object", "additionalProperties": false, "required": ["time", "value", "inTangent", "outTangent"], "properties": { "time": { "type": "number" }, "value": { "type": "number" }, "inTangent": { "type": "number" }, "outTangent": { "type": "number" } } },
    "particleCurve": { "type": "object", "additionalProperties": false, "required": ["mode", "multiplier", "constantMin", "constantMax", "curveMin", "curveMax"], "properties": { "mode": { "enum": ["Constant", "Curve", "TwoCurves", "TwoConstants"] }, "multiplier": { "type": "number" }, "constantMin": { "type": "number" }, "constantMax": { "type": "number" }, "curveMin": { "type": "array", "maxItems": 128, "items": { "$ref": "#/$defs/particleCurveKey" } }, "curveMax": { "type": "array", "maxItems": 128, "items": { "$ref": "#/$defs/particleCurveKey" } } } },
    "particleColorKey": { "type": "object", "additionalProperties": false, "required": ["time", "color"], "properties": { "time": { "type": "number", "minimum": 0, "maximum": 1 }, "color": { "$ref": "#/$defs/color" } } },
    "particleGradient": { "type": "object", "additionalProperties": false, "required": ["mode", "gradientMin", "gradientMax"], "properties": { "mode": { "enum": ["Color", "Gradient", "TwoColors", "TwoGradients", "RandomColor"] }, "colorMin": { "$ref": "#/$defs/color" }, "colorMax": { "$ref": "#/$defs/color" }, "gradientMin": { "type": "array", "maxItems": 32, "items": { "$ref": "#/$defs/particleColorKey" } }, "gradientMax": { "type": "array", "maxItems": 32, "items": { "$ref": "#/$defs/particleColorKey" } } } },
    "particleAxes": { "type": "object", "additionalProperties": false, "required": ["enabled", "separateAxes"], "properties": { "enabled": { "type": "boolean" }, "separateAxes": { "type": "boolean" }, "space": { "enum": ["Local", "World", "Custom"] }, "x": { "$ref": "#/$defs/particleCurve" }, "y": { "$ref": "#/$defs/particleCurve" }, "z": { "$ref": "#/$defs/particleCurve" } } },
    "particleBurst": { "type": "object", "additionalProperties": false, "required": ["time", "countMin", "countMax", "cycleCount", "repeatInterval", "probability"], "properties": { "time": { "type": "number", "minimum": 0 }, "countMin": { "type": "number", "minimum": 0 }, "countMax": { "type": "number", "minimum": 0 }, "cycleCount": { "type": "integer", "minimum": 1, "maximum": 1000 }, "repeatInterval": { "type": "number", "minimum": 0 }, "probability": { "type": "number", "minimum": 0, "maximum": 1 } } },
    "particleNoise": { "type": "object", "additionalProperties": false, "required": ["enabled", "separateAxes", "frequency", "damping", "octaveCount", "octaveMultiplier", "octaveScale"], "properties": { "enabled": { "type": "boolean" }, "separateAxes": { "type": "boolean" }, "strengthX": { "$ref": "#/$defs/particleCurve" }, "strengthY": { "$ref": "#/$defs/particleCurve" }, "strengthZ": { "$ref": "#/$defs/particleCurve" }, "frequency": { "type": "number", "exclusiveMinimum": 0 }, "scrollSpeed": { "$ref": "#/$defs/particleCurve" }, "damping": { "type": "boolean" }, "octaveCount": { "type": "integer", "minimum": 1, "maximum": 4 }, "octaveMultiplier": { "type": "number", "minimum": 0, "maximum": 1 }, "octaveScale": { "type": "number", "exclusiveMinimum": 0 }, "quality": { "enum": ["Low", "Medium", "High"] } } }
  }
}
