{
  "schemaVersion": 1,
  "type": "enemyAnimation",
  "id": "core:enemy-animation/hunter/idle",
  "enemy": "core:enemy/hunter",
  "displayName": "hunter idle",
  "durationSeconds": 1.5,
  "frameRate": 60.0,
  "loop": true,
  "tracks": [
    {
      "target": "bone/chest",
      "property": "rotation.z",
      "keys": [
        {
          "time": 0.0,
          "value": -6.77800035,
          "inTangent": 0.0,
          "outTangent": 0.0
        },
        {
          "time": 1.0,
          "value": -4.182,
          "inTangent": 0.0,
          "outTangent": 0.0
        },
        {
          "time": 1.5,
          "value": -6.77800035,
          "inTangent": 0.0,
          "outTangent": 0.0
        }
      ]
    },
    {
      "target": "bone/arm-right-upper",
      "property": "rotation.z",
      "keys": [
        {
          "time": 0.0,
          "value": -20.554,
          "inTangent": 0.0,
          "outTangent": 0.0
        },
        {
          "time": 1.0,
          "value": -22.6330013,
          "inTangent": 0.0,
          "outTangent": 0.0
        },
        {
          "time": 1.5,
          "value": -20.554,
          "inTangent": 0.0,
          "outTangent": 0.0
        }
      ]
    },
    {
      "target": "bone/arm-left-upper",
      "property": "rotation.z",
      "keys": [
        {
          "time": 0.0,
          "value": -20.554,
          "inTangent": 0.0,
          "outTangent": 0.0
        },
        {
          "time": 1.0,
          "value": -22.6330013,
          "inTangent": 0.0,
          "outTangent": 0.0
        },
        {
          "time": 1.5,
          "value": -20.554,
          "inTangent": 0.0,
          "outTangent": 0.0
        }
      ]
    },
    {
      "target": "bone/arm-right-lower",
      "property": "rotation.z",
      "keys": [
        {
          "time": 0.0,
          "value": 56.7320023,
          "inTangent": 0.0,
          "outTangent": 0.0
        },
        {
          "time": 1.0,
          "value": 51.887,
          "inTangent": 0.0,
          "outTangent": 0.0
        },
        {
          "time": 1.5,
          "value": 56.7320023,
          "inTangent": 0.0,
          "outTangent": 0.0
        }
      ]
    },
    {
      "target": "bone/arm-left-lower",
      "property": "rotation.z",
      "keys": [
        {
          "time": 0.0,
          "value": 56.7320023,
          "inTangent": 0.0,
          "outTangent": 0.0
        },
        {
          "time": 1.0,
          "value": 51.887,
          "inTangent": 0.0,
          "outTangent": 0.0
        },
        {
          "time": 1.5,
          "value": 56.7320023,
          "inTangent": 0.0,
          "outTangent": 0.0
        }
      ]
    },
    {
      "target": "bone/head",
      "property": "rotation.z",
      "keys": [
        {
          "time": 0.0,
          "value": -3.357,
          "inTangent": 0.0,
          "outTangent": 0.0
        },
        {
          "time": 1.0,
          "value": -12.1390009,
          "inTangent": 1.90734863E-06,
          "outTangent": 0.0
        },
        {
          "time": 1.5,
          "value": -3.357,
          "inTangent": -3.81469727E-06,
          "outTangent": 0.0
        }
      ]
    },
    {
      "target": "bone/hand-right",
      "property": "rotation.z",
      "keys": [
        {
          "time": 0.0,
          "value": -14.069,
          "inTangent": 0.0,
          "outTangent": 0.0
        },
        {
          "time": 1.0,
          "value": -12.078001,
          "inTangent": 0.0,
          "outTangent": 0.0
        },
        {
          "time": 1.5,
          "value": -14.069,
          "inTangent": 0.0,
          "outTangent": 0.0
        }
      ]
    },
    {
      "target": "bone/hand-left",
      "property": "rotation.z",
      "keys": [
        {
          "time": 0.0,
          "value": -14.069,
          "inTangent": 0.0,
          "outTangent": 0.0
        },
        {
          "time": 1.0,
          "value": -12.078001,
          "inTangent": 0.0,
          "outTangent": 0.0
        },
        {
          "time": 1.5,
          "value": -14.069,
          "inTangent": 0.0,
          "outTangent": 0.0
        }
      ]
    },
    {
      "target": "bone/leg-right-upper",
      "property": "rotation.z",
      "keys": [
        {
          "time": 0.0,
          "value": 25.9980011,
          "inTangent": 0.0,
          "outTangent": 0.0
        },
        {
          "time": 1.0,
          "value": 23.593,
          "inTangent": 0.0,
          "outTangent": 0.0
        },
        {
          "time": 1.5,
          "value": 25.9980011,
          "inTangent": 0.0,
          "outTangent": 0.0
        }
      ]
    },
    {
      "target": "bone/leg-left-upper",
      "property": "rotation.z",
      "keys": [
        {
          "time": 0.0,
          "value": 26.513,
          "inTangent": 0.0,
          "outTangent": 0.0
        },
        {
          "time": 1.0,
          "value": 24.1080017,
          "inTangent": 0.0,
          "outTangent": 0.0
        },
        {
          "time": 1.5,
          "value": 26.513,
          "inTangent": 0.0,
          "outTangent": 0.0
        }
      ]
    },
    {
      "target": "bone/root",
      "property": "rotation.z",
      "keys": [
        {
          "time": 0.0,
          "value": 0.0,
          "inTangent": 0.0,
          "outTangent": 0.0
        },
        {
          "time": 1.0,
          "value": 1.7650001,
          "inTangent": -4.76837158E-07,
          "outTangent": 0.0
        },
        {
          "time": 1.5,
          "value": 0.0,
          "inTangent": 9.536743E-07,
          "outTangent": 0.0
        }
      ]
    },
    {
      "target": "bone/antenna-r",
      "property": "rotation.z",
      "keys": [
        {
          "time": 0.0,
          "value": 0.0,
          "inTangent": 0.0,
          "outTangent": 0.0
        },
        {
          "time": 1.0,
          "value": -3.29600024,
          "inTangent": 4.76837158E-07,
          "outTangent": 0.0
        },
        {
          "time": 1.5,
          "value": 0.0,
          "inTangent": -9.536743E-07,
          "outTangent": 0.0
        }
      ]
    },
    {
      "target": "bone/antenna-l",
      "property": "rotation.z",
      "keys": [
        {
          "time": 0.0,
          "value": 0.0,
          "inTangent": 0.0,
          "outTangent": 0.0
        },
        {
          "time": 1.0,
          "value": -5.56000042,
          "inTangent": 1.90734863E-06,
          "outTangent": 0.0
        },
        {
          "time": 1.5,
          "value": 0.0,
          "inTangent": -3.81469727E-06,
          "outTangent": 0.0
        }
      ]
    },
    {
      "target": "bone/penis",
      "property": "rotation.z",
      "keys": [
        {
          "time": 0.0,
          "value": 16.957,
          "inTangent": 0.0,
          "outTangent": 0.0
        },
        {
          "time": 1.0,
          "value": 14.0440006,
          "inTangent": 0.0,
          "outTangent": 0.0
        },
        {
          "time": 1.5,
          "value": 16.957,
          "inTangent": 0.0,
          "outTangent": 0.0
        }
      ]
    },
    {
      "target": "bone/balls",
      "property": "rotation.z",
      "keys": [
        {
          "time": 0.0,
          "value": 13.402,
          "inTangent": 0.0,
          "outTangent": 0.0
        },
        {
          "time": 1.0,
          "value": 10.489,
          "inTangent": 0.0,
          "outTangent": 0.0
        },
        {
          "time": 1.5,
          "value": 13.402,
          "inTangent": 0.0,
          "outTangent": 0.0
        }
      ]
    },
    {
      "target": "bone/neck",
      "property": "rotation.z",
      "keys": [
        {
          "time": 0.0,
          "value": -9.673,
          "inTangent": 0.0,
          "outTangent": 0.0
        },
        {
          "time": 1.5,
          "value": -9.673,
          "inTangent": 0.0,
          "outTangent": 0.0
        }
      ]
    },
    {
      "target": "bone/hips",
      "property": "rotation.z",
      "keys": [
        {
          "time": 0.0,
          "value": -15.151001,
          "inTangent": 0.0,
          "outTangent": 0.0
        },
        {
          "time": 1.5,
          "value": -15.151001,
          "inTangent": 0.0,
          "outTangent": 0.0
        }
      ]
    },
    {
      "target": "bone/leg-right-lower",
      "property": "rotation.z",
      "keys": [
        {
          "time": 0.0,
          "value": -9.985001,
          "inTangent": 0.0,
          "outTangent": 0.0
        },
        {
          "time": 1.5,
          "value": -9.985001,
          "inTangent": 0.0,
          "outTangent": 0.0
        }
      ]
    },
    {
      "target": "bone/leg-left-lower",
      "property": "rotation.z",
      "keys": [
        {
          "time": 0.0,
          "value": -11.236,
          "inTangent": 0.0,
          "outTangent": 0.0
        },
        {
          "time": 1.5,
          "value": -11.236,
          "inTangent": 0.0,
          "outTangent": 0.0
        }
      ]
    },
    {
      "target": "bone/hips",
      "property": "position.x",
      "keys": [
        {
          "time": 0.0,
          "value": 0.0,
          "inTangent": 0.0,
          "outTangent": 0.0
        },
        {
          "time": 1.5,
          "value": 0.0,
          "inTangent": 0.0,
          "outTangent": 0.0
        }
      ]
    },
    {
      "target": "bone/hips",
      "property": "position.y",
      "keys": [
        {
          "time": 0.0,
          "value": -0.146,
          "inTangent": 0.0,
          "outTangent": 0.0
        },
        {
          "time": 1.5,
          "value": -0.146,
          "inTangent": 0.0,
          "outTangent": 0.0
        }
      ]
    }
  ],
  "objectTracks": [],
  "events": [],
  "effects": [],
  "effectTriggers": [],
  "warnings": [],
  "source": {
    "unityClip": "Assets/AnimationClip/Idle_4.anim",
    "semanticName": "idle"
  }
}