{
  "schemaVersion": 1,
  "type": "enemyAnimation",
  "id": "core:enemy-animation/spider-mother/upper-body-idle",
  "enemy": "core:enemy/spider-mother",
  "displayName": "spider-mother upper-body-idle",
  "durationSeconds": 2.0,
  "frameRate": 60.0,
  "loop": true,
  "tracks": [
    {
      "target": "bone/chest",
      "property": "rotation.z",
      "keys": [
        {
          "time": 0.0,
          "value": 0.0,
          "inTangent": 0.0,
          "outTangent": 0.0
        },
        {
          "time": 1.0,
          "value": -1.542,
          "inTangent": -4.76837158E-07,
          "outTangent": 0.0
        },
        {
          "time": 2.0,
          "value": 0.0,
          "inTangent": 4.76837158E-07,
          "outTangent": 0.0
        }
      ]
    },
    {
      "target": "bone/arm-left-upper",
      "property": "rotation.z",
      "keys": [
        {
          "time": 0.0,
          "value": 0.0,
          "inTangent": 0.0,
          "outTangent": 0.0
        },
        {
          "time": 1.0,
          "value": 1.16500008,
          "inTangent": 2.38418579E-07,
          "outTangent": 0.0
        },
        {
          "time": 2.0,
          "value": 0.0,
          "inTangent": -2.38418579E-07,
          "outTangent": 0.0
        }
      ]
    },
    {
      "target": "bone/arm-right-upper",
      "property": "rotation.z",
      "keys": [
        {
          "time": 0.0,
          "value": 0.0,
          "inTangent": 0.0,
          "outTangent": 0.0
        },
        {
          "time": 1.0,
          "value": -0.686000049,
          "inTangent": 1.1920929E-07,
          "outTangent": 0.0
        },
        {
          "time": 2.0,
          "value": 0.0,
          "inTangent": -1.1920929E-07,
          "outTangent": 0.0
        }
      ]
    },
    {
      "target": "bone/arm-right-lower",
      "property": "rotation.z",
      "keys": [
        {
          "time": 0.0,
          "value": 0.0,
          "inTangent": 0.0,
          "outTangent": 0.0
        },
        {
          "time": 1.0,
          "value": -0.708,
          "inTangent": -1.1920929E-07,
          "outTangent": 0.0
        },
        {
          "time": 2.0,
          "value": 0.0,
          "inTangent": 1.1920929E-07,
          "outTangent": 0.0
        }
      ]
    },
    {
      "target": "bone/hand-right",
      "property": "rotation.z",
      "keys": [
        {
          "time": 0.0,
          "value": 0.0,
          "inTangent": 0.0,
          "outTangent": 0.0
        },
        {
          "time": 1.0,
          "value": 4.99600029,
          "inTangent": 0.0,
          "outTangent": 0.0
        },
        {
          "time": 2.0,
          "value": 0.0,
          "inTangent": 0.0,
          "outTangent": 0.0
        }
      ]
    }
  ],
  "objectTracks": [],
  "events": [],
  "effects": [],
  "effectTriggers": [],
  "warnings": [],
  "source": {
    "unityClip": "Assets/AnimationClip/IdleUpperBody.anim",
    "semanticName": "upper-body-idle"
  }
}