{
  "schemaVersion": 1,
  "type": "enemyAnimation",
  "id": "core:enemy-animation/zombie-1/finisher-phase-5",
  "enemy": "core:enemy/zombie-1",
  "displayName": "zombie-1 finisher-phase-5",
  "durationSeconds": 1.0,
  "frameRate": 60.0,
  "loop": true,
  "tracks": [
    {
      "target": "bone/hips",
      "property": "rotation.z",
      "keys": [
        {
          "time": 0.0,
          "value": -11.6620007,
          "inTangent": 0.0,
          "outTangent": 0.0
        },
        {
          "time": 0.5,
          "value": 15.0770006,
          "inTangent": 1.52587891E-05,
          "outTangent": 0.0
        },
        {
          "time": 1.0,
          "value": -11.6620007,
          "inTangent": -1.52587891E-05,
          "outTangent": 0.0
        }
      ]
    },
    {
      "target": "bone/leg-left-upper",
      "property": "rotation.z",
      "keys": [
        {
          "time": 0.0,
          "value": 77.4500046,
          "inTangent": 0.0,
          "outTangent": 0.0
        },
        {
          "time": 0.5,
          "value": 43.594,
          "inTangent": 0.0,
          "outTangent": 0.0
        },
        {
          "time": 1.0,
          "value": 77.4500046,
          "inTangent": 0.0,
          "outTangent": 0.0
        }
      ]
    },
    {
      "target": "bone/leg-left-lower",
      "property": "rotation.z",
      "keys": [
        {
          "time": 0.0,
          "value": -70.301,
          "inTangent": 0.0,
          "outTangent": 0.0
        },
        {
          "time": 0.5,
          "value": -73.719,
          "inTangent": 0.0,
          "outTangent": 0.0
        },
        {
          "time": 1.0,
          "value": -70.301,
          "inTangent": 0.0,
          "outTangent": 0.0
        }
      ]
    },
    {
      "target": "bone/foot-left",
      "property": "rotation.z",
      "keys": [
        {
          "time": 0.0,
          "value": 5.348,
          "inTangent": 0.0,
          "outTangent": 0.0
        },
        {
          "time": 0.5,
          "value": 15.4330006,
          "inTangent": 0.0,
          "outTangent": 0.0
        },
        {
          "time": 1.0,
          "value": 5.348,
          "inTangent": 0.0,
          "outTangent": 0.0
        }
      ]
    },
    {
      "target": "bone/leg-right-upper",
      "property": "rotation.z",
      "keys": [
        {
          "time": 0.0,
          "value": -3.72300029,
          "inTangent": 0.0,
          "outTangent": 0.0
        },
        {
          "time": 0.5,
          "value": -44.1280022,
          "inTangent": -1.52587891E-05,
          "outTangent": 0.0
        },
        {
          "time": 1.0,
          "value": -3.72300029,
          "inTangent": 1.52587891E-05,
          "outTangent": 0.0
        }
      ]
    },
    {
      "target": "bone/leg-right-lower",
      "property": "rotation.z",
      "keys": [
        {
          "time": 0.0,
          "value": -48.5280037,
          "inTangent": 0.0,
          "outTangent": 0.0
        },
        {
          "time": 0.5,
          "value": -26.8130016,
          "inTangent": -7.62939453E-06,
          "outTangent": 0.0
        },
        {
          "time": 1.0,
          "value": -48.5280037,
          "inTangent": 7.62939453E-06,
          "outTangent": 0.0
        }
      ]
    },
    {
      "target": "bone/foot-right",
      "property": "rotation.z",
      "keys": [
        {
          "time": 0.0,
          "value": 63.4780045,
          "inTangent": 0.0,
          "outTangent": 0.0
        },
        {
          "time": 0.5,
          "value": 55.3490028,
          "inTangent": 0.0,
          "outTangent": 0.0
        },
        {
          "time": 1.0,
          "value": 63.4780045,
          "inTangent": 0.0,
          "outTangent": 0.0
        }
      ]
    },
    {
      "target": "bone/spine",
      "property": "rotation.z",
      "keys": [
        {
          "time": 0.0,
          "value": -31.3990021,
          "inTangent": 0.0,
          "outTangent": 0.0
        },
        {
          "time": 0.5,
          "value": -52.6120033,
          "inTangent": 0.0,
          "outTangent": 0.0
        },
        {
          "time": 1.0,
          "value": -31.3990021,
          "inTangent": 0.0,
          "outTangent": 0.0
        }
      ]
    },
    {
      "target": "bone/arm-left-upper",
      "property": "rotation.z",
      "keys": [
        {
          "time": 0.0,
          "value": 100.193008,
          "inTangent": 0.0,
          "outTangent": 0.0
        },
        {
          "time": 0.5,
          "value": 102.192,
          "inTangent": 0.0,
          "outTangent": 0.0
        },
        {
          "time": 1.0,
          "value": 100.193008,
          "inTangent": 0.0,
          "outTangent": 0.0
        }
      ]
    },
    {
      "target": "bone/arm-left-lower",
      "property": "rotation.z",
      "keys": [
        {
          "time": 0.0,
          "value": 35.257,
          "inTangent": 0.0,
          "outTangent": 0.0
        },
        {
          "time": 0.5,
          "value": 43.469,
          "inTangent": 0.0,
          "outTangent": 0.0
        },
        {
          "time": 1.0,
          "value": 35.257,
          "inTangent": 0.0,
          "outTangent": 0.0
        }
      ]
    },
    {
      "target": "bone/neck",
      "property": "rotation.z",
      "keys": [
        {
          "time": 0.0,
          "value": -4.224,
          "inTangent": 0.0,
          "outTangent": 0.0
        },
        {
          "time": 0.5,
          "value": 28.488,
          "inTangent": -1.52587891E-05,
          "outTangent": 0.0
        },
        {
          "time": 1.0,
          "value": -4.224,
          "inTangent": 1.52587891E-05,
          "outTangent": 0.0
        }
      ]
    },
    {
      "target": "bone/head",
      "property": "rotation.z",
      "keys": [
        {
          "time": 0.0,
          "value": 15.475,
          "inTangent": 0.0,
          "outTangent": 0.0
        },
        {
          "time": 0.5,
          "value": -10.4100008,
          "inTangent": 0.0,
          "outTangent": 0.0
        },
        {
          "time": 1.0,
          "value": 15.475,
          "inTangent": 0.0,
          "outTangent": 0.0
        }
      ]
    },
    {
      "target": "bone/arm-right-upper",
      "property": "rotation.z",
      "keys": [
        {
          "time": 0.0,
          "value": 12.2680006,
          "inTangent": 0.0,
          "outTangent": 0.0
        },
        {
          "time": 0.5,
          "value": 3.693,
          "inTangent": 0.0,
          "outTangent": 0.0
        },
        {
          "time": 1.0,
          "value": 12.2680006,
          "inTangent": 0.0,
          "outTangent": 0.0
        }
      ]
    },
    {
      "target": "bone/arm-right-lower",
      "property": "rotation.z",
      "keys": [
        {
          "time": 0.0,
          "value": 104.672005,
          "inTangent": 0.0,
          "outTangent": 0.0
        },
        {
          "time": 0.5,
          "value": 112.885,
          "inTangent": 0.0,
          "outTangent": 0.0
        },
        {
          "time": 1.0,
          "value": 104.672005,
          "inTangent": 0.0,
          "outTangent": 0.0
        }
      ]
    },
    {
      "target": "bone/penis",
      "property": "rotation.z",
      "keys": [
        {
          "time": 0.0,
          "value": 33.282,
          "inTangent": 0.0,
          "outTangent": 0.0
        },
        {
          "time": 1.0,
          "value": 33.282,
          "inTangent": 0.0,
          "outTangent": 0.0
        }
      ]
    },
    {
      "target": "bone/chest",
      "property": "rotation.z",
      "keys": [
        {
          "time": 0.0,
          "value": -36.9260025,
          "inTangent": 0.0,
          "outTangent": 0.0
        },
        {
          "time": 1.0,
          "value": -36.9260025,
          "inTangent": 0.0,
          "outTangent": 0.0
        }
      ]
    },
    {
      "target": "bone/hips",
      "property": "position.x",
      "keys": [
        {
          "time": 0.0,
          "value": 0.043,
          "inTangent": 0.0,
          "outTangent": 0.0
        },
        {
          "time": 0.5,
          "value": 0.095,
          "inTangent": -1.49011612E-08,
          "outTangent": 0.0
        },
        {
          "time": 1.0,
          "value": 0.043,
          "inTangent": 1.49011612E-08,
          "outTangent": 0.0
        }
      ]
    },
    {
      "target": "bone/hips",
      "property": "position.y",
      "keys": [
        {
          "time": 0.0,
          "value": -0.411,
          "inTangent": 0.0,
          "outTangent": 0.0
        },
        {
          "time": 0.5,
          "value": -0.385,
          "inTangent": 0.0,
          "outTangent": 0.0
        },
        {
          "time": 1.0,
          "value": -0.411,
          "inTangent": 0.0,
          "outTangent": 0.0
        }
      ]
    }
  ],
  "objectTracks": [],
  "events": [
    {
      "time": 0.5,
      "type": "cue",
      "amount": 0.0,
      "cue": "finisher.thrust"
    }
  ],
  "effects": [],
  "effectTriggers": [],
  "warnings": [],
  "source": {
    "unityClip": "Assets/AnimationClip/Rape5_10.anim",
    "semanticName": "finisher-phase-5"
  }
}