{
  "schemaVersion": 1,
  "type": "enemyAnimation",
  "id": "core:enemy-animation/zombie-grabber/jump",
  "enemy": "core:enemy/zombie-grabber",
  "displayName": "zombie-grabber jump",
  "durationSeconds": 1.0,
  "frameRate": 60.0,
  "loop": true,
  "tracks": [
    {
      "target": "bone/hips",
      "property": "rotation.z",
      "keys": [
        {
          "time": 0.0,
          "value": -2.22800016,
          "inTangent": 0.0,
          "outTangent": 0.0
        },
        {
          "time": 1.0,
          "value": 3.88100028,
          "inTangent": -1.90734863E-06,
          "outTangent": 0.0
        }
      ]
    },
    {
      "target": "bone/leg-right-upper",
      "property": "rotation.z",
      "keys": [
        {
          "time": 0.0,
          "value": -11.668,
          "inTangent": 0.0,
          "outTangent": 0.0
        },
        {
          "time": 1.0,
          "value": 5.604,
          "inTangent": 0.0,
          "outTangent": 0.0
        }
      ]
    },
    {
      "target": "bone/leg-right-lower",
      "property": "rotation.z",
      "keys": [
        {
          "time": 0.0,
          "value": -17.156,
          "inTangent": 0.0,
          "outTangent": 0.0
        },
        {
          "time": 1.0,
          "value": -48.7250023,
          "inTangent": -3.81469727E-06,
          "outTangent": 0.0
        }
      ]
    },
    {
      "target": "bone/leg-left-upper",
      "property": "rotation.z",
      "keys": [
        {
          "time": 0.0,
          "value": 10.9590006,
          "inTangent": 0.0,
          "outTangent": 0.0
        },
        {
          "time": 1.0,
          "value": 28.231,
          "inTangent": 0.0,
          "outTangent": 0.0
        }
      ]
    },
    {
      "target": "bone/leg-left-lower",
      "property": "rotation.z",
      "keys": [
        {
          "time": 0.0,
          "value": -22.062,
          "inTangent": 0.0,
          "outTangent": 0.0
        },
        {
          "time": 1.0,
          "value": -53.6310043,
          "inTangent": -7.62939453E-06,
          "outTangent": 0.0
        }
      ]
    },
    {
      "target": "bone/arm-left-upper",
      "property": "rotation.z",
      "keys": [
        {
          "time": 0.0,
          "value": 30.453001,
          "inTangent": 0.0,
          "outTangent": 0.0
        },
        {
          "time": 1.0,
          "value": 49.087,
          "inTangent": -3.81469727E-06,
          "outTangent": 0.0
        }
      ]
    },
    {
      "target": "bone/arm-right-upper",
      "property": "rotation.z",
      "keys": [
        {
          "time": 0.0,
          "value": 30.453001,
          "inTangent": 0.0,
          "outTangent": 0.0
        },
        {
          "time": 1.0,
          "value": 44.2640038,
          "inTangent": -3.81469727E-06,
          "outTangent": 0.0
        }
      ]
    },
    {
      "target": "bone/arm-left-lower",
      "property": "rotation.z",
      "keys": [
        {
          "time": 0.0,
          "value": 37.541,
          "inTangent": 0.0,
          "outTangent": 0.0
        },
        {
          "time": 1.0,
          "value": 48.671,
          "inTangent": 0.0,
          "outTangent": 0.0
        }
      ]
    },
    {
      "target": "bone/arm-right-lower",
      "property": "rotation.z",
      "keys": [
        {
          "time": 0.0,
          "value": 37.541,
          "inTangent": 0.0,
          "outTangent": 0.0
        },
        {
          "time": 1.0,
          "value": 48.373,
          "inTangent": 0.0,
          "outTangent": 0.0
        }
      ]
    },
    {
      "target": "bone/penis",
      "property": "rotation.z",
      "keys": [
        {
          "time": 0.0,
          "value": 0.0,
          "inTangent": 0.0,
          "outTangent": 0.0
        },
        {
          "time": 1.0,
          "value": 11.1170006,
          "inTangent": 0.0,
          "outTangent": 0.0
        }
      ]
    },
    {
      "target": "bone/neck",
      "property": "rotation.z",
      "keys": [
        {
          "time": 0.0,
          "value": 0.0,
          "inTangent": 0.0,
          "outTangent": 0.0
        },
        {
          "time": 1.0,
          "value": 11.1830006,
          "inTangent": 3.81469727E-06,
          "outTangent": 0.0
        }
      ]
    },
    {
      "target": "bone/spine",
      "property": "rotation.z",
      "keys": [
        {
          "time": 0.0,
          "value": 1.82700014,
          "inTangent": 0.0,
          "outTangent": 0.0
        },
        {
          "time": 1.0,
          "value": 1.82700014,
          "inTangent": 0.0,
          "outTangent": 0.0
        }
      ]
    },
    {
      "target": "bone/chest",
      "property": "rotation.z",
      "keys": [
        {
          "time": 0.0,
          "value": 7.69400024,
          "inTangent": 0.0,
          "outTangent": 0.0
        },
        {
          "time": 1.0,
          "value": 7.69400024,
          "inTangent": 0.0,
          "outTangent": 0.0
        }
      ]
    }
  ],
  "objectTracks": [],
  "events": [],
  "effects": [],
  "effectTriggers": [],
  "warnings": [],
  "source": {
    "unityClip": "Assets/AnimationClip/Jump_6.anim",
    "semanticName": "jump"
  }
}